"__PL__","Đề_nghị bỏ_phiếu tín_nhiệm định_kỳ Mặc_dù dự_án luật đặt việc sửa_đổi nội_dung này nhưng ông Phú kiến_nghị sửa hướng bỏ_phiếu tín_nhiệm định_kỳ thay_vì thực_hiện khi có ít_nhất 20 % đại_biểu QH đề_nghị như luật hiện_hành Ông Phú cho rằng nếu qui_định như hiện_nay thì việc bỏ_phiếu tín_nhiệm khả_thi thực_hiện khó tập_hợp 20 % số phiếu Dự_án Luật sửa_đổi bổ_sung điều Luật tổ_chức QH tập_trung nội_dung gồm thành_lập ủy_ban pháp_luật và ủy_ban tư_pháp cơ_sở tách bổ_sung nhiệm_vụ quyền_hạn Ủy_ban Pháp_luật Quốc_hội thành_lập Ủy_ban Kinh_tế và Ủy_ban Tài_chính ngân_sách cơ_sở tách bổ_sung nhiệm_vụ quyền_hạn Ủy_ban Kinh_tế và ngân_sách QH tái_lập chức_danh tổng_thư_ký QH giúp QH Ủy_ban Thường_vụ QH công_việc hành_chính chuyên_môn nghiệp_vụ khi tách và thành_lập Ủy_ban Tư_pháp hoặc Ủy_ban giám_sát tư_pháp ủy_ban này có nhiệm_vụ giám_sát hoạt_động Chính_phủ Viện_Kiểm_sát_nhân_dân tối_cao Tòa_án nhân_dân tối_cao việc điều_tra truy_tố xét_xử thi_hành án bổ_trợ tư_pháp và giám_sát việc phát_hiện xử_lý tham_nhũng đại_biểu kiến_nghị nâng Ban Dân_nguyện Ủy_ban Thường_vụ QH lên thành Ủy_ban Dân_nguyện QH giúp QH chuyên_sâu hơn họat động đó có việc giải_quyết đơn thư công_dân một vấn_đề bức_xúc hiện_nay "
"__PL__","Hôm_qua 29.4 nguồn tin TAND tối_cao TP. HCM cho biết ngày 19.5 tới ca_sĩ người Anh Gary_Glitter tên thật là Paul_Francis Gadd 62 tuổi được đưa xét_xử theo trình_tự phúc_thẩm TP. HCM. Hội_đồng xét_xử phúc_thẩm gồm 3 người Trương_Vĩnh_Thủy Nguyễn Hoàng_Tiến và Trương_Thị_Minh_Thơ là thẩm_phán TAND tối_cao Như Báo Thanh_Niên đưa tin ngày 3.3.2005 TAND tỉnh Bà_Rịa Vũng_Tàu tuyên_phạt Gary Glitter 3 năm tù_giam tội_danh dâm_ô trẻ_em Nhưng Gary Glitter miệng cho rằng đây là một âm_mưu báo_chí nước_ngoài nhằm bôi_nhọ danh_dự nhân_phẩm ông ta và nộp đơn kháng_cáo xin Tòa_phúc_thẩm TAND tối_cao TP. HCM xem_xét_lại bản_án sơ_thẩm "
"__PL__","Dùng mã_tấu chém cả nhà NLĐ Ngày 18 1 anh Huỳnh_Văn_An Trưởng Công_an xã Thanh_Phú huyện Bến_Lức Long_An cho biết xác_định danh_tính nhóm côn_đồ_dùng mã_tấu chém nhiều người nhà em Nguyễn_Tấn_Nghĩa ngụ ấp Tấn_Long Đó là Cù Thanh_Nhàn cầm_đầu Nguyễn Thái_Bình Phạm_Thanh_Duy Hồ Hải Tường Tất_cả ngụ ấp Phước_Tĩnh xã Long_Hiệp Bến_Lức lúc 22 giờ ngày 14 1 khi gây_gổ em Nguyễn_Tấn_Nghĩa 19 tuổi Cù Thanh_Nhàn cùng đồng_bọn xông vào nhà em Nghĩa dùng mã_tấu chém bị_thương nhiều người nhà em em Nghĩa bị chúng dùng đá xanh ném trúng mắt làm tổn_thương xương mí mắt May_mắn là lực_lượng công_an huyện xã có_mặt kịp_thời đẩy_lùi nhóm côn_đồ quá_khích và đưa người bị_thương bệnh_viện điều_trị theo anh Huỳnh_Văn_An hiện Công_an xã Thanh_Phú tiến_hành củng_cố hồ_sơ chuyển công_an huyện xem_xét xử_lý Nhàn hai hành_vi gây_rối và cố_ý gây thương_tích người dân địa_phương Nhàn dẫn đàn_em sang địa_phương này gây_rối chém người gây thương_tích đó có con_trai ông ấp Tấn_Long "
"__PL__","Phá động mại_dâm vùng giáp_ranh TP HCM Long_An_Tối 1 6 Phòng Cảnh_sát hình_sự Công_an TP HCM cùng Công_an tỉnh Long_An bất_ngờ ập khám_xét khách_sạn Mỹ_Yên Bến_Lức Long_An bắt quả_tang 5 cặp nam_nữ mua_bán_dâm cô gái khai nhận là nhân_viên 3 quán cà_phê đèn mờ kề nhau xã Bình_Chánh Bình_Chánh TP HCM. 15 đối_tượng liên_quan bị tạm giữ gồm 3 bà chủ quán cà_phê Nguyễn_Thị_Phượng Ngô Mỹ_Tiên Quách Thị Kim_Anh chủ_khách_sạn Mỹ_Yên tiếp_tân khách_sạn cùng 5 gái mại_dâm và 5 khách mua_dâm khai_thác ban_đầu tụ_điểm mại_dâm núp_bóng quán cà_phê này tổ_chức cuộc mây mưa tiếp_viên khách làng_chơi 10h tối Họ tận_dụng địa_bàn giáp_ranh TP HCM và tỉnh Long_An công_khai tổ_chức hoạt_động mua_bán_dâm 3 quán có tên gọi mùi_mẫn là Mi_Mi Thiên_Thiên và tên "
"__PL__","Buộc thôi_việc 2 lãnh_đạo Vườn quốc_gia U_Minh_Thượng Hôm_qua UBND tỉnh Kiên_Giang thông_báo quyết_định kỷ_luật cách_chức buộc thôi_việc hai ông Lê_Văn Thật và Phạm_Văn Dũng là phó_giám_đốc Vườn quốc_gia U_Minh_Thượng Hai ông có hành_vi lợi_dụng chức_vụ sai_phạm quản_lý tạo điều_kiện đối_tượng khai_thác rừng trái_phép tháng 7 2003 lợi_dụng lúc Giám_đốc Vườn quốc_gia U_Minh_Thượng_đi công_tác nước_ngoài ông Phạm_Văn Dũng ký đơn vợ ông Thật cùng người_thân khai_thác trái_phép 5,9 ha rừng tràm gây thiệt_hại giá_trị lâm_sản 110 triệu đồng Liên_quan vụ_việc này ông Phạm_Văn_Giàu Phó_trưởng_phòng Nghiên_cứu khoa_học Vườn quốc_gia U_Minh_Thượng bị cách_chức buộc thôi_việc "
"__PL__","Vụ kiện đòi nợ Sở LĐTBXH Khánh_Hòa Sau lần hòa giải thành TAND thành_phố Nha_Trang cho biết mở phiên sơ_thẩm_xét_xử án Công_ty TNHH Hoa_Viên đòi Sở Lao_động Thương_binh và Xã_hội tỉnh Khánh_Hoà thanh_toán tiền đầy_đủ tiền theo hợp_đồng xây_dựng ký_kết Dự_kiến phiên_xử diễn ngày 10 5 đơn kiện nguyên đơn Công_ty Hoa_Viên trúng_thầu thi_công hạng_mục cây_xanh toàn_bộ làng trẻ_em SOS Nha_Trang Ngày 2 7 1999 chủ đầu_tư là Sở Lao_động Thương_binh Xã_hội Khánh_Hoà ký hợp_đồng kinh_tế Hoa_Viên Sở cam_kết thanh_toán đầy_đủ tiền chậm 10 ngày khi hạng_mục hoàn_thành Ngày 2 11 2000 chủ đầu_tư nghiệm_thu và ký biên_bản nhận công_trình tổng giá_trị phải quyết_toán Hoa_Viên hơn 352 triệu đồng bên thi_công Sở giao đầy_đủ tiền tháng 10 2001 Sở còn nợ Hoa_Viên tiền gốc gần 50,5 triệu đồng tính cả lãi nợ phát_sinh nay là hơn 78 triệu đồng Công_ty gửi nhiều văn_bản và đến gặp trực_tiếp lãnh_đạo Sở đề_nghị thanh_toán nhưng được trả lẽ đó họ đâm_đơn kiện ra tòa "
"__PL__","Bắt một đối_tượng băng cướp sử_dụng súng NLĐ Ngày 14 2 Công_an TPHCM bắt Nguyễn Văn_Nguyên SN 1982 tên gọi khác là Thanh ngụ quận 2 TPHCM hành_vi tố_giác tội_phạm Nguyên là đối_tượng liên_quan băng_nhóm tội_phạm nguy_hiểm dùng vũ_khí trái_phép cướp tài_sản Lê Thái_Phước SN 1978 tự Lém cầm_đầu Như_vậy nay Ban Chuyên_án bắt khẩn_cấp 6 đối_tượng băng này thu_giữ loại vũ_khí nguy_hiểm lời khai ban_đầu đối_tượng bị bắt_giữ chúng thực_hiện một vụ cướp tiệm vàng Long_An nhưng bất_thành và dùng súng cướp một chiếc xe gắn_máy một cặp tình_nhân một bãi đất hoang địa_bàn quận 9 TPHCM. "
"__VT__","Điện_thoại_di_động Cuộc đua kiểu_dáng chuyên_gia thiết_kế kiểu_dáng ĐTDĐ Hãng Samsung ông Park In_Gon đời_sống một kiểu_dáng độ ba tháng và thời_gian này được rút ngắn cuộc đua cạnh_tranh gay_gắt hãng Dạo một vòng hội_chợ ĐTDĐ diễn Singapore người xem phải choáng_váng nhiều kiểu_dáng ĐTDĐ được hãng giới_thiệu mỗi nhà mỗi vẻ Có chiếc ĐTDĐ giống như hộp phấn trang_điểm dành quí bà có chiếc giống như món đồ_chơi xinh_xắn màu_sắc tươi_vui dành khách_hàng nhí rồi thì hoa_văn màu_sắc đa_dạng sinh_động đáp_ứng đủ loại thị_hiếu lứa tuổi Chuyên_gia Hãng Samsung Park In_Gon nhấn_mạnh tính thời_trang ĐTDĐ. Điều này khó nhận sự xuất_hiện liên_tục kiểu ĐTDĐ và tất_nhiên mê_hoặc người tiêu_dùng dẫn chuyện thay_đổi xoành_xoạch ĐTDĐ như thay áo Cái ĐTDĐ dùng alô mà trở_thành một vật trang_sức làm điệu làm sang Ông Park_In Gon cho biết phục_vụ đẹp ĐTDĐ bộ_phận thiết_kế kiểu_dáng Samsung gồm 150 người làm_việc nhiều trung_tâm đặt nhiều nước theo nhiều trường_phái kiểu Mỹ châu Âu châu Á Mỗi năm bộ_phận này đưa ra 2.000 kiểu_dáng tất_cả tạo ý_tưởng mới_lạ độc_đáo điên_rồ nhất Tuy_nhiên 15 % số đó được chọn qua con mắt chuyên_nghiệp và tỉnh_táo bộ_phận marketing trở_thành chiếc ĐTDĐ thật_sự Ông Park_In Gon tiết_lộ con_số kinh_phí đầu_tư song ông nói bộ_phận trăm nhà thiết_kế này được dành nhiều ưu_đãi nhất nhiệm_vụ tìm kiểu_dáng độc_đáo giống ai làm thế_nào chinh_phục người tiêu_dùng khó_tính nhất Thật_ra xu_hướng thời_trang_hóa ĐTDĐ nhiều vật_dụng quen_thuộc ngày được thay_đổi hình_tượng liên_tục xuất_hiện nhiều kiểu_dáng mới_lạ nhìn chung_quanh ta cây bút_bi điện_thoại bàn cái radio nhỏ rồi móc áo được nhà thiết_kế kiểu_dáng chăm_chút khoác bộ_cánh mới một lần có_mặt hội_chợ hàng gia_dụng Hong_Kong chúng_tôi thật_sự choáng_ngợp bất_ngờ sự phong_phú mức hình_dung kiểu_dáng mới một cái móc áo công_dụng đơn_giản được trình_diễn trăm mẫu thiết_kế thích_hợp căn phòng khác nhau cuộc đua cạnh_tranh đây nhà sản_xuất chú_ý nâng cao tính_năng sản_phẩm thêm công_dụng này thêm tiện_ích kia Nhưng nay khi mà điều này bão hòa người tiêu_dùng cần nhiều công_dụng phức_tạp thì nhu_cầu cái đẹp tính thời_trang sản_phẩm trở_thành chính_yếu vai_trò nhà thiết_kế kiểu_dáng sản_phẩm trở_nên quan_trọng VN xuất_hiện công_ty chuyên về thiết_kế kiểu_dáng công_nghiệp và họ có khách_hàng đầu_tiên Nhiều doanh_nghiệp biết tìm cái riêng độc_đáo kiểu_dáng sản_phẩm như một lợi_thế cạnh_tranh Họ bắt_đầu tham_gia cuộc đua kiểu_dáng "
"__VT__","Microsoft ra_mắt bản Windows giá 36 USD châu Á Sản_phẩm này mang tên Windows XP Starter_Edition là giải_pháp tốt người có thu_nhập thấp và muốn dùng Linux Microsoft cho biết cung_cấp phiên_bản này Thái_Lan và Malaysia tháng 9 tới giá 36 USD bản khi đó phiên_bản Windows XP chuẩn hiện_nay giá 499 USD. nỗ_lực đẩy_lùi nạn vi_phạm bản_quyền ông Nguyễn_Anh Tuấn Vụ_trưởng Vụ Công_nghiệp CNTT thuộc Bộ Bưu_chính Viễn_Thông cho biết Bộ đàm_phán Microsoft cung_cấp sản_phẩm này VN đặc_biệt là cơ_quan tổ_chức chính_phủ Microsoft Windows XP Starter_Edition gồm có Internet_Explorer Windows Media_Player và tính_năng khác có phiên_bản đầy_đủ Windows XP. Đặc_biệt chương_trình này có tính_năng khác nhằm giúp người sử_dụng máy_tính một_cách dễ_dàng hơn Microsoft buộc phải có chính_sách ưu_tiên thị_trường máy_tính châu Á theo dự_đoán chuyên_gia tương_lai châu Á trở_thành khu_vực phát_triển công_nghệ lớn nhất thế_giới và hãng muốn đánh mất thị_trường béo_bở này và muốn chứng_kiến cảnh đối_thủ khác qua_mặt mình "
"__VT__","Xbox Live đạt 1 triệu khách_hàng Xbox_Live dịch_vụ chơi game trực_tuyến Microsoft cho phép game thủ sử_dụng máy Xbox tranh tài nhau mạng Internet có được khách_hàng thứ 1 triệu Thông_tin được hãng sản_xuất phần_mềm lớn nhất thế_giới công_bố hôm_qua Xbox Live được Microsoft đưa năm 2002 và đạt mức 1 triệu khách_hàng đầu_tiên dịch_vụ này nhanh gấp 3 lần so dịch_vụ có đăng_ký hãng khác như AOL và TiVo Microsoft nhấn_mạnh tính_năng kết_nối Internet bộ điều_khiển Xbox xem đây là ưu_thế vượt_trội so sản_phẩm cạnh_tranh PlayStation 2 Sony Tuy_nhiên đời máy PlayStation gần đây bổ_sung thêm adapter ethenet cho phép kết_nối Internet và giá hạ xuống 149 USD giá Xbox Microsoft hiện_nay có hơn 100 đầu game chơi được Xbox_Live và họ hy_vọng con_số này tăng lên 150 cuối năm nay Đầu năm nay Microsoft và nhà phát_hành game lớn nhất thế_giới Electronic_Arts gạt bỏ bất_đồng hợp_tác nâng cao vị_thế Xbox đó EA đồng_ý phát_hành game thể_thao hàng_đầu họ Xbox_Live bên cạnh đầu game khác Microsoft bổ_sung thêm nhiều tính_năng Xbox_Live năm nay bao_gồm khả_năng lưu_trữ dữ_liệu Internet xây_dựng giải_đấu qua mạng và trao_đổi tin nhắn người dùng Xbox Live khác "
"__VT__","Nghẽn mạch ĐTDĐ ngoài tầm kiểm_soát Chương_trình miễn cước cuộc_gọi nội mạng đầu_tiên ngày giới_hạn thời_gian Viettel gần như phá_sản khi điều đó làm mạng này bị nghẽn nghiêm_trọng nhưng chiêu này được mạng di_động MobiFone áp_dụng đợt khuyến_mãi mình mặc_dù thời_lượng được giới_hạn gói cước Vinaphone cùng việc giảm cước tăng_cường hình_thức khuyến_mãi mà theo họ việc này nhằm mục_đích chăm_sóc và giữ_chân khách_hàng Giải_thưởng được Vinaphone đưa là chuyến du_lịch nước_ngoài tổng giá_trị gần 1 tỉ đồng khi đó nhà cung_cấp mạng di_động công_nghệ CDMA S Fone tiếp_tục chương_trình miễn_phí hòa mạng và chọn số đẹp mạng này được triển_khai Bà Nguyễn_Thị_Kim Thoa chuyên_viên pháp_lý và đối_ngoại S Fone cho biết mục_đích đợt khuyến_mãi là chăm_sóc khách_hàng chứ chú_trọng việc thu_hút nhiều thuê_bao dám hứa Trao_đổi Tuổi_Trẻ ông Trần_Mạnh_Hùng phó_tổng_giám_đốc Tổng_công_ty Bưu_chính viễn_thông VN VNPT cho biết trường_hợp tổ_chức khuyến_mãi hai nhà cung_cấp Vinaphone và MobiFone phải tính_toán dung_lượng mạng nhằm tránh tình_trạng sự_cố khi số thuê_bao tăng vọt Ông Trần_Đức_Lai thứ_trưởng Bộ Bưu_chính viễn_thông cho rằng việc khách_hàng thao_tác 1 2 lần thực_hiện cuộc_gọi có_thể nằm tiêu_chuẩn cung_cấp dịch_vụ nhưng nếu tình_trạng này kéo_dài thì phải lên_tiếng cảnh_báo chất_lượng mạng "
"__VT__","MPT tiếp_tục ban_hành 7 quyết_định điều_chỉnh giá cước viễn_thông Tổng_công_ty BC VT Việt_Nam VNPT Bộ quy_định_giá cước dịch_vụ điện_thoại quốc_tế IDD và dịch_vụ điện_thoại quốc_tế IP chiều đi dịch_vụ thuê kênh viễn_thông quốc_tế dịch_vụ thuê kênh quốc_tế áp_dụng doanh_nghiệp cung_cấp dịch_vụ kết_nối Internet IXP thuê kết_nối Internet quốc_tế dịch_vụ thuê kênh viễn_thông tỉnh dịch_vụ thuê kênh viễn_thông nội_tỉnh và dịch_vụ thuê kênh viễn_thông nội_hạt Công_ty Viễn_thông Quân_đội Viettel MPT quy_định mức cước dịch_vụ điện_thoại quốc_tế IP chiều đi Thời_gian quyết_định có hiệu_lực dịch_vụ VNPT ngày 1 5 2004 và Viettel ngày 15 4 2004 Đặc_biệt thay_vì quy_định mức cước cứng như đây tinh_thần Quyết_định 217 Thủ_tướng Chính_phủ việc điều_chỉnh cước lần này Bộ quy_định khung_giá doanh_nghiệp cung_cấp dịch_vụ tự quy_định mức cước cụ_thể khung_giá tạo điều_kiện doanh_nghiệp hoạt_động lĩnh_vực viễn_thông và Internet Bộ quy_định doanh_nghiệp có giấy_phép cung_cấp dịch_vụ VT được áp_dụng mức cước thuê kênh là mức sàn khung bảng cước doanh_nghiệp chiếm thị_phần khống_chế Bộ quy_định Đồng_thời lĩnh_vực thông_tin di_động MPT điều_chỉnh mức chênh_lệch cước kết_nối DN phải trả VNPT và VNPT phải trả DN lên 15 % thay_vì 9 % như đây "
"__VT__","Đề_xuất phương_án đơn_giản_hóa việc trói thuê_bao trả trước đó khách_hàng đăng_ký thuê_bao trả trước mới phải đến cơ_sở nhà cung_cấp dịch_vụ khai_báo thông_tin mà khi kích_hoạt sim cần khai số CMND mình và gửi tổng_đài nhà cung_cấp dịch_vụ Nhà cung_cấp dịch_vụ kiểm_tra thông_tin đó kho dữ_liệu Bộ Công_an xác_định tên tuổi khách_hàng Tuy_nhiên đây hoàn_toàn là giải_pháp tốt trường_hợp khách_hàng có chứng_minh_thư nhà cung_cấp dịch_vụ cho biện_pháp trói thuê_bao trả trước đáp_ứng yêu_cầu đảm_bảo_an_ninh mà thực_tế thông_qua biện_pháp kỹ_thuật nhà cung_cấp xác_định thuê_bao có hành_vi vi_phạm_pháp_luật Ngoài_ra việc trói thuê_bao trả trước ảnh_hưởng nghiêm_trọng mục_tiêu phát_triển 32 42 triệu thuê_bao điện_thoại cả di_động và cố_định năm 2010 "
"__VT__","Ai phát_minh chiếc điện_thoại_di_động đầu_tiên Tiến_sĩ Martin_Cooper tổng_giám_đốc đơn_vị hệ_thống Motorola được coi là cha_đẻ thiết_bị liên_lạc di_động cầm tay và là người đầu_tiên thực_hiện một cuộc_gọi thông_qua công_cụ này Ý_tưởng liên_lạc di_động được bộ_phận nghiên_cứu ATT thuộc Trung_tâm Bell_Labs Mỹ đưa năm 1947 Nhưng cuối năm 60 và đầu thập_kỷ 70 thế_kỷ trước Motorola và Bell Labs thực_sự trở_thành 2 đối_thủ lao vào_cuộc đua việc tích_hợp công_nghệ này thiệt bị cá_nhân di_động Kỹ_sư điện Cooper có 4 năm phục_vụ hải_quân khi chuyển làm_việc một công_ty viễn_thông nhỏ Năm 1954 ông được Motorola tuyển_dụng và tham_gia phát_triển sản_phẩm di_động đáng chú_ý là công_cụ liên_lạc radio di_động đầu_tiên dành cảnh_sát Chicago năm 1967 Năm 1973 ông thiết_lập một trạm thu phát New_York đồng_thời tung ra mẫu đầu_tiên cái gọi là điện_thoại_di_động cellphone máy Motorola_Dyna Tac cuộc thử_nghiệm ban_đầu Washington Cooper và Motorola quyết_định đưa công_nghệ tới New_York quảng_bá công_chúng Motorola_Dyna Tac chiếc điện_thoại_di_động đầu_tiên Kích_thước cm 22,86 x 12,7 x 4,44 Trọng_lượng 1,13 kgMàn hình cóSố bo_mạch điện 30Thời lượng thoại 35 phútThời lượng pin 10 tiếngTính năng Nói nghe quay số Ngày 3 4 1973 đứng một phố gần khách_sạn Manhattan_Hilton Cooper quyết_định thử thực_hiện một cuộc_gọi riêng khi đi lên gác tham_dự một cuộc họp_báo giới_thiệu thiết_bị Cú điện_thoại ấy được ông gọi đối_thủ cạnh_tranh mình Joel_Engel Giám_đốc Trung_tâm thí_nghiệm Bell_Labs tuyệt_vời hòn gạch biết nói nặng hơn 1kg Cooper hoạt_động tốt kết_nối ông trạm thu phát đặt nóc_tòa_tháp Burlington_Consolidated nay là tòa nhà Alliance Capital_Building New_York đồng_thời liên_lạc cả đường_dây cố_định người đường tỏ ngạc_nhiên khi thấy một người đàn_ông bấm bấm một công_cụ gì đó áp sát tai và say_sưa nói_chuyện Nói tương_lai ngành di_động tiến_sĩ Cooper năm nay ngoài 70 tuổi cho rằng thế_giới viễn_thông thực_ra non_trẻ và bắt_đầu bùng_nổ Động_lực quá_trình bùng_nổ ấy trước_hết là quan_niệm kinh_doanh đó chú_trọng người tiêu_dùng Quan_trọng là một nền hoạt_động mở đó có công_nghệ mới khả_năng tăng_cường khai_thác giải tần Bên cạnh đó nhà phát_minh viễn_thông cho rằng cần có chính_sách ưu_tiên đối_tượng biết khai_thác tốt giải tần sóng hiện có thay_đổi diễn nhanh nhưng 10 năm tới đó là chuyển_biến có tính cơ_bản Cooper nhận_định Lời khuyên tôi về công_nghệ liên_lạc di_động tương_lai nhất_là thị_trường phát_triển là từ chậm nhưng hiệu_quả ông cần thận_trọng việc phân_bổ giải tần ứng_dụng_cụ_thể Và khi phân_bổ dù là thế_hệ 3G hay 4G cần tiến_hành một_cách hợp_lý tùy thực_tế mỗi thị_trường nước phát_triển Cooper cho rằng nên vội cuốn sự cám_dỗ xu_thế nhảy sang 3G khi nào thấy rõ ích_lợi cụ_thể mỗi ngành kinh_tế và mỗi quốc_gia "
