"__TG__","Vụ khủng_hoảng con_tin Ảrập Xêút qua lời nhân_chứng kỹ_sư người Mỹ gốc Iraq Abu_Hashem 45 tuổi thử_thách bắt_đầu sáng 29 5 tiếng súng nổ khi ông rời khu Oasis đi làm Ông lao vội vào nhà đưa vợ và 2 con sang nhà hàng_xóm Rồi ông đi tìm một nhân_viên an_ninh 4 thanh_niên Ảrập_Xêút râu tuổi khoảng 18 25 đi ngang qua Tôi hỏi họ anh có phải là nhân_viên an_ninh Họ nói Phải Rồi họ nói Anh có phải là người Hồi_giáo Tôi trả_lời Đúng Chứng_minh đi xem nào họ nói Hashem nhớ Ông nhanh_chóng nhận đó phải là nhân_viên an_ninh nhưng đưa giấy_tờ tuỳ_thân chứng_tỏ mình theo đạo Hồi Rồi chúng nói Mày là người Mỹ và tôi khẳng_định tôi là người Mỹ theo đạo Hồi Chúng nói Chúng_tao giết người Hồi và trở_nên lịch_sự rồi xin_lỗi vì đột_nhập vào nhà tôi Hashem kể Kỹ_sư này giảng_giải lối sống người Hồi Chúng nói Chúng_ta bảo_vệ đất_nước và chúng_ta muốn loại_bỏ kẻ có tín_ngưỡng Khi đi cùng chiến_binh Abu_Hashem nhìn thấy thi_thể một đầu_bếp phương Tây Abu_Hashem trở_lại nhà khi được phép và liên_tục nghe tiếng súng nổ khi lực_lượng an_ninh sơ_tán gia_đình sáng thứ 7 Abdul Salam_al Hakawati nhân_viên tài_chính doanh_nghiệp Libăng 38 tuổi khu Oasis cho biết cùng vợ và con_trai 2 tuổi gác thì nghe thấy tiếng súng gác anh nghe thấy tay súng_lục_lọi rồi một tên nói Đây là nhà người Hồi chắc nhìn thấy đoạn kinh Koran được đóng_khung tường Al Hakawati kể rằng một thanh_niên khoảng 20 mang súng_máy và đeo thắt_lưng đạn đi lên tầng trên chào anh tiếng Ảrập Người này hỏi liệu có phải anh là người Ảrập hay tín_đồ Hồi_giáo Khi anh nói phải tay súng bảo Chúng_ta muốn làm tổn_thương người phương Tây và người Mỹ Anh cho tôi biết chúng_tôi có tìm chúng ở đâu Lấy lý_do đến khu nhà anh trả_lời là biết Tay súng chào rồi quay gót khi rời đi anh ta nói Cuộc_thánh chiến chúng_ta là nhằm người Mỹ và phương Tây chứ phải Hồi_giáo Baskar_Benkataramani kỹ_sư máy_tính Ấn_Độ 44 tuổi đi công_tác cho biết một cuộc_gọi bàn lễ_tân khách_sạn Oasis cứu_mạng ông có vấn_đề an_ninh ông cảnh_báo ở yên phòng lễ_tân hướng_dẫn Dùng khóa kép cửa và khoá lỗ khóa Đừng mở_cửa bất_kỳ ai phút sau ông nghe thấy tiếng súng tiếng la_hét rồi cả tiếng nổ lớn Có tiếng đập cửa Tôi nhìn qua lỗ nhỏ và thấy một nhân_viên khách_sạn bị dí súng 2 bên thái_dương Benkatarami kể khi trở về nhà Dubai tiểu Vương_quốc Ảrập Thống_nhất Sợ_hãi ông trốn gầm giường gây một tiếng_động nào dù nhỏ Tôi nghe thấy tiếng lựu_đạn khi phát_nổ ông kể Kỹ_sư dùng điện_thoại_di_động liên_lạc một đồng sự ở cùng lực_lượng an_ninh bên ngoài khách_sạn Tôi bồn_chồn Tôi hỏi liệu có nên nhảy ra ngoài cửa_sổ Có_thể tôi bị gãy chân nhưng ít_nhất tôi giữ mạng sống Benkataramani kể Nhưng tôi được khuyên là nên yên tại_chỗ Sáng sớm chủ_nhật lực_lượng an_ninh Ảrập Xêút phòng ông và nhận là cảnh_sát Một sĩ_quan đưa ông tầng 5 nơi vị khách khác chờ được sơ_tán Bên trong khách_sạn là một cảnh_tượng đổ_nát cửa vỡ kính vỡ máu sàn tường chiến_binh Ảrập Xêút bắt con_tin nước_ngoài 30 05 2004 Lực_lượng an_ninh Ảrập Xêút bắn chết 2 nghi phạm 02 06 2004 Australia cảnh_báo vụ tấn_công mới Ảrập_Xêút 31 05 2004 Ảrập Xêút săn nghi phạm Al Qaeda vụ Khobar 31 05 2004 Đặc_công Ảrập Xêút giải_cứu con_tin 30 05 2004 "
"__TG__","Con_tin Trung_Quốc Pakistan bị doạ giết Một quan_chức tình_báo Pakistan hôm_qua cho biết nhóm chiến_binh giam_giữ Teng và Wang_Ende hai kỹ_sư Trung_Quốc bị bắt_cóc sáng 9 10 Islamabad một ngày xem_xét yêu_sách phóng_thích tất_cả du_kích nước_ngoài nếu giết con_tin Chúng_còn đe_doạ phát_nổ 2 con_tin và bản_thân nếu lực_lượng an_ninh tìm cách giải_cứu kẻ bắt_cóc gài thuốc_nổ quanh người và mang theo lựu_đạn Giới_chức Pakistan cho biết có 4 kẻ tham_gia vụ bắt con_tin người Trung_Quốc bao_gồm 3 du_kích nước_ngoài và một thành_viên bộ_lạc địa_phương Hai kỹ_sư Trung_Quốc bị bắt_cóc khi tới dự_án đập Gomalzam nam Waziristan khu_vực bộ_lạc xa_xôi và nguy_hiểm nhất phía tây bắc Pakistan Con đập cách biên_giới Afghanistan khoảng 75 km Đại_sứ_quán Trung_Quốc Islamabad bình_luận lời đe_doạ và yêu_sách nói trên Họ nhận thông_báo kỹ_sư an_toàn và bị một bộ_lạc giam_giữ "
"__TG__","Chính_sách giết có mục_tiêu Israel Nhiều thập_kỷ nay Israel tiến_hành ám_sát mục_tiêu mà họ cho là nguy_hiểm an_ninh quốc_gia Tuy_nhiên năm gần đây chính_sách này được đẩy_mạnh thành một phần nỗ_lực ngăn_ngừa tấn_công tự_sát chính_phủ Do_Thái Kể khi phong_trào intifada Palestine mở_màn tháng 9 2000 chục du_kích Hamas và Jihad Hồi_giáo bị giết Cách đây 3 năm vụ giết người có mục_tiêu được quan_chức Thái mô_tả là biện_pháp hiếm_hoi và ngoại_lệ Tuy_nhiên hiện_nay số_lượng vụ_việc kiểu này tăng mạnh cách nói quân_đội Do_Thái mục_tiêu bao_gồm quả bom hẹn giờ kẻ đánh bom tự_sát như thủ_lĩnh du_kích như nhà sáng_lập Hamas_Yassin Lực_lượng được huy_động là đông binh_lính Israel nhóm nhỏ hoặc cá_nhân lực_lượng an_ninh hay vụ tấn_công tên_lửa máy_bay chiến_đấu và trực_thăng vụ không_kích cướp đi mạng sống người đứng gần vô_tội bản báo_cáo một nhóm nhân_quyền Palestine năm_ngoái hơn 130 người Palestine bị Israel nhằm mục_tiêu và hạ_sát hơn 60 người đứng gần đó thiệt_mạng mục_tiêu cấp cao Tháng 1 1996 Yahya_Ayyash du_kích Hamas bị giết vai_trò kỹ_sư vụ đánh bom Năm 1997 Cơ_quan mật_vụ Israel_Mossad thất_bại vụ giết_hại Khalad_Mishal thủ_lĩnh chính_trị Hamas Jordan Tháng 7 2002 Salah_Shahada thủ_lĩnh cánh quân_sự Hamas Dải_Gaza bị giết_hại Tháng 6 2003 Abdul Aziz_al Rantissi thành_viên cao_cấp phát_ngôn_viên Hamas bị mưu_sát Tháng 8 2003 Ismail Abu_Shanab thành_viên Hamas cao_cấp bị giết Tháng 9 2003 Thủ_lĩnh tinh_thần Hamas Yassin thoát chết vụ mưu_sát Tháng 3 2004 Yassin bị ám_sát Chính_sách Israel trở_thành một vấn_đề gây chia_rẽ nhiều cuộc tranh_cãi lộ_trình hoà_bình Mỹ hậu_thuẫn thủ_lĩnh du_kích Palestine cho biết tôn_trọng thoả_thuận ngừng_bắn nếu Tel_Aviv chấm_dứt việc ám_sát Tuy_nhiên quan_chức Do_Thái khẳng_định họ có quyền nhằm du_kích bị cho là mối đe_doạ nếu lực_lượng an_ninh Palestine bắt_giữ họ hoặc giúp ngăn_chặn vụ tấn_công tự_sát Chính_sách giết có mục_tiêu làm cộng_đồng quốc_tế đặc_biệt là Liên_minh châu Âu EU Anh và quốc_gia Ảrập tức_giận Mỹ chỉ_trích kế_hoạch này là vô_ích nỗ_lực hoà_bình nhưng lên_án gay_gắt nhóm nhân_quyền cả lãnh_thổ Israel lẫn nước_ngoài lên_án vụ tấn_công chỉ ra rằng dân_thường phải chịu thương_vong Họ còn đặt câu hỏi việc Tel_Aviv hành_quyết nghi phạm mà cần xét_xử khi đó Israel mất trăm dân_thường cuộc tấn_công tự_sát cho rằng chính_sách đó là hợp_pháp số_nhân_vật bị lực_lượng an_ninh Do_Thái nhằm mục_tiêu trực_tiếp liên_quan quá_trình lên kế_hoạch và thực_thi vụ đánh bom nhằm thường_dân họ Đây là cách duy_nhất loại_bỏ thủ_lĩnh du_kích Yassin thủ_lĩnh tinh_thần Hamas cho nay là nhân_vật quan_trọng bị Israel giết kể khi phong_trào intifada bùng_phát Địa_vị mục_tiêu hàng_đầu ông khẳng_định hồi tháng 9 năm_ngoái khi máy_bay phản_lực F16 thả quả bom nặng 227 kg một ngôi nhà mà ông tới thăm thành_phố Gaza Yassin thoát chết và Hamas cảnh_báo_vụ oanh kích mở cánh cửa địa_ngục phần mình Thủ_tướng Israel Ariel_Sharon tuyên_bố tất_cả thủ_lĩnh Hamas bị điểm tên mặt danh_sách phải chết Trái mong_muốn Israel chính_sách giết có mục_tiêu gây ra vòng xoáy bạo_lực Giáng_sinh năm_ngoái lực_lượng an_ninh Thái giết 2 nhân_vật cao_cấp Jihad Hồi_giáo 3 thường_dân bỏ_mạng giờ sau quả bom một người đánh bom tự_sát Palestine cướp đi mạng sống bản_thân và 3 người Israel Tiếp đó binh_lính Thái tràn thành_phố Bờ Tây_Nablus rồi một loạt vụ đánh bom tự_sát Palestine xảy gần biên_giới Israel và Dải_Gaza Người_ta còn rõ ảnh_hưởng lâu_dài vụ ám_sát ông Yassin nhưng chắc_chắn cái chết ông cực_đoan hoá Hamas hơn "
"__TG__","Mỹ tấn_công Iran tương_lai gần lực_lượng đặc_nhiệm Vệ_binh Cách_mạng Iran một cuộc tập_trận Iran hôm_qua 9 4 gạt một bên cái mà họ gọi là một cuộc chiến_tranh tâm_lý Mỹ chống chương_trình hạt_nhân nước này khi có bài báo mô_tả việc Lầu Năm Góc dự_định tấn_công cơ_sở hạt_nhân Iran Chúng_tôi xem việc hoạch_định cuộc không_kích là chiến_tranh tâm_lý xuất_phát sự tức_giận và bất_lực Mỹ người phát_ngôn Bộ Ngoại_giao Iran Hamid Reza_Asefi tuyên_bố phóng_viên tờ báo Mỹ cuối tuần qua đưa tin Nhà_Trắng xem_xét lựa_chọn tấn_công quân_sự nhằm triệt_hạ tiềm_lực hạt_nhân Iran Dẫn lời quan_chức và chuyên_gia phân_tích giấu tên Mỹ báo Washington_Post hôm_qua cho biết có cuộc tấn_công nào tương_lai gần nhưng quan_chức chuẩn_bị cuộc tấn_công đó như một sự chọn_lựa khả_dĩ và sử_dụng sự đe_dọa này buộc Iran thừa_nhận tính nghiêm_trọng ý_định hạt_nhân họ nhà hoạch_định Lầu Năm Góc và CIA thăm_dò nhiều mục_tiêu chẳng_hạn như cơ_sở làm_giàu uranium ngầm Iran Natanz và nhà_máy chuyển_đổi uranium Isfahan cả hai tọa_lạc miền Trung_Iran khi đó tạp_chí The_New_Yorker số ngày 17 4 cho biết nhà cầm_quyền Mỹ dự_tính một chiến_dịch đánh bom quy_mô lớn chống Iran bao_gồm sử_dụng bom hạt_nhân phá boong ke triệt_hạ cơ_sở tình_nghi như Natanz Người Mỹ muốn tìm_kiếm một giải_pháp hồ_sơ hạt_nhân Iran và tìm cách tạo khủng_hoảng Họ muốn chúng_tôi đạt một thỏa_thuận Cơ_quan Nguyên_tử năng Quốc_tế IAEA và người châu Âu ông Asefi nói Ông Asefi cảnh_báo Iran từ_bỏ quyền hạt_nhân mình sẵn_sàng đối_phó bất_kỳ_tình_huống nào và sợ lời đe_dọa ông Asefi là một sai_lầm lớn khi Mỹ và đồng_minh nghĩ rằng IAEA buộc Tehran từ_bỏ việc làm_giàu uranium nhưng Iran sẵn_sàng hợp_tác IAEA và rằng tổng_giám_đốc IAEA đến Iran cuối tuần này thảo_luận sự hợp_tác Iran IAEA. Cũng ngày hôm_qua Ngoại_trưởng Anh Jack Straw đài BBC bác_bỏ thông_tin báo_chí Mỹ toan_tính tấn_công quân_sự chống Iran chính_quyền Bush Ông Straw cho biết ông tin_tưởng Washington cam_kết sử_dụng biện_pháp đàm_phán và áp_lực ngọai giao giải_quyết vấn_đề Iran "
"__TG__","47 người thiệt_mạng lở đất Trung_Quốc Khoảng 3 giờ sáng nay tỉnh Quý_Châu tây nam Trung_Quốc xảy một vụ lở đất làm 47 người thiệt_mạng Hiện nhân_viên cứu_hộ tìm xác nạn_nhân bị vùi đất 47 người bị chôn vùi và có 12 người bị_thương Guo_Yan chủ_tịch Cục an_toàn tỉnh Quý_Châu cho biết có hy_vọng nạn_nhân trên sống_sót người khác may_mắn chạy thoát Ông Guo cho biết một khối đất lớn dài 500 m rộng 200 m và ầay 3 m đổ ngôi làng cách thủ_phủ Quý_Dương thuộc Quý Châu 200 km Khối đất nhấn_chìm 13 ngôi nhà Có tới 108 người ngủ đó khi vụ tai_nạn xảy 4 máy_ủi đất và hơn 300 nhân_viên cứu_hộ được huy_động tìm_kiếm nạn_nhân nhưng 12 tiếng tìm thi_thể_nào Người đứng đầu làng Zuo Gongqiang gọi điện hiện_trường cho biết tình_huống bây_giờ nghiêm_trọng Chúng_tôi nhìn thấy nóc ngôi nhà bị chôn vùi ông nói nhiều thân_nhân nạn_nhân và đào lớp đất đá tay tìm người_thân khi đó giới_chức Trung_Quốc cho biết xác_định rõ nguyên_nhân vụ lở đất Nhưng chắc_chắn nguyên_nhân phải thời_tiết Thời_tiết hôm_nay đẹp ông Zhang một quan_chức chính_quyền địa_phương hay Tuy_nhiên người đứng đầu làng ông Zuo cho biết mỏ than là tác_nhân gây ra vụ lở đất Tai_nạn xảy là khu mỏ than hoạt_động đây Chúng_tôi chuẩn_bị di_dời khu dân_cư tới nơi khác ngày tới nhiều ngôi nhà bị nứt và bị chấn_động hàng ngày mỏ than hoạt_động Thật may là vụ lở đất xảy ra khi chúng_tôi rời đi ông nói thêm Dân địa_phương cho rằng việc khai_thác mỏ gây ra vụ lở đất vụ tai_nạn hôm_nay 500 số 1.500 người khu_vực này được di_tản vùng an_toàn hơn Chính_quyền địa_phương gửi đại_diện hiện_trường điều_tra nguyên_nhân Vụ lở đất là một chuỗi tai_nạn nghiêm_trọng Trung_Quốc vòng 6 tuần nay ngành khai_thác than nước này "
"__TG__","Bắc Triều_Tiên_doạ cắt đàm_phán Nhật_Bình_Nhưỡng hôm_qua ám_chỉ khả_năng ngừng đàm_phán Tokyo số_phận con_tin Nhật bị bắt_cóc thập_kỷ trước họ cảm_thấy việc duy_trì liên_lạc quan_trọng Một phát_ngôn_viên Bộ Ngoại_giao CHDCND Triều_Tiên cho biết Bình_Nhưỡng công_nhận hay chấp_nhận bản báo_cáo mới_đây Tokyo cuộc điều_tra Bắc Triều_Tiên_tiến_hành liên_quan số_phận công_dân Nhật bị Bình_Nhưỡng bắt_cóc Tuần trước Nhật yêu_cầu nước này điều_tra số_phận công_dân họ và tuyên_bố có biện_pháp cứng_rắn nếu Bình_Nhưỡng phản_ứng chân_thành và mau_chóng Tuy_nhiên họ nói rõ có trừng_phạt kinh_tế hay Bắc Triều_Tiên_cảnh_báo coi biện_pháp trừng_phạt kinh_tế là một lời tuyên_chiến và doạ loại Nhật khỏi vòng đàm_phán 6 bên về chương_trình hạt_nhân Bình_Nhưỡng Hồi tháng 11 CHDCND Tiều_Tiên trao_trả hài_cốt mà theo lời họ là Megumi_Yokota và Kaoru_Matsuki 2 số 13 công_dân Nhật bị Bình_Nhưỡng bắt_cóc thập_kỷ 1970 và 1980 xét_nghiệm AND cho thấy đây là xương người khác "
"__TG__","Sinh_viên Mỹ và gánh nặng_nợ_nần Gánh nặng_nợ_nần đè nặng lên ít sinh_viên Mỹ khi họ ra trường Tom_Dillon sinh_viên dược 19 tuổi Đại_học Connecticut Mỹ mắc nợ 52.000 USD khoản vay dành sinh_viên bắt_đầu việc học Dillon khỏi lo_lắng Khi tốt_nghiệp tôi có một món nợ khoản 150.000 USD và tôi phải phụ_thuộc nó một thời_gian dài Gánh nặng này Dillon nặng thêm ngày 1 7 khi lãi_suất khoản vay sinh_viên tăng lên 6,8 % mức cao kể năm 2001 Sự gia_tăng này gây ra ít khó_khăn thế_hệ sinh_viên hiện_nay Mỹ Gánh nặng_nợ_nần buộc nhiều sinh_viên hoãn để_dành tiền kết_hôn mua nhà hay việc học_hành con_cái họ sau_này Ngoài_ra theo Diana_Cantor Giám_đốc tổ_chức Virginia College Savings_Plan nợ_nần ngăn nhiều người trẻ tuổi nhảy thương_trường Cantor nói sinh_viên mới tốt_nghiệp chịu mạo_hiểm kinh_doanh số tiền ít_ỏi mà họ có Đây thực_sự là một cuộc khủng_hoảng Họ bị mắc_kẹt khi bắt_đầu sự_nghiệp mình Theo nhóm tư_vấn Project on Student_Debt số nợ trung_bình một sinh_viên đại_học Mỹ tăng 50 % 10 năm qua Cách đây 25 năm sinh_viên muốn mắc nợ dùng tiền kiếm công_việc bán thời_gian hay vào mùa hè trang_trải việc học Tuy_nhiên kể đó học_phí tăng cao so mức tăng giá tiêu_dùng như số tiền mà sinh_viên kiếm công_việc nói trên Nicjalous_Reykdal một sinh_viên ngành sư_phạm Đại_học Central_Washington bản_thân anh như tất_cả bạn_bè phải vay tiền trang_trải việc học và lo_lắng sự gia_tăng lãi_suất nói buộc họ phải mất nhiều năm trả hết nợ Sự giảm_sút khoản hỗ_trợ trực_tiếp góp_phần khiến nợ sinh_viên ngày_càng cao Quốc_hội Mỹ tăng thêm ngân_sách chương_trình Pell vốn là hình_thức hỗ_trợ trực_tiếp phổ_biến nhất sinh_viên có thu_nhập thấp kể năm 2003 Số tiền tối_đa mà một sinh_viên có_thể nhận từ_chương_trình này là 4.500 USD năm Luke_Swarthout một chuyên_gia nhóm nghiên_cứu Public Interest Research_Group nói tính sự lạm_phát thì chương_trình Pell trở_nên lạc_hậu nói chi mức học_phí trường đại_học sinh_viên đến gia_đình có thu_nhập trung_bình lâm tình_trạng dở khóc dở cười Mức thu_nhập gia_đình khiến họ đủ tiêu_chuẩn xin hỗ_trợ trực_tiếp nhưng nhiều trang_trải đầy_đủ việc học Tom_Dillon là một người lâm hoàn_cảnh này Thu_nhập gia_đình khiến Dillon được xin hỗ_trợ tài_chính_trực_tiếp Nhưng Dillon 3 em_gái đó có 2 người vào đại_học nên bố_mẹ đủ tiền đóng học_phí anh Điều này khiến Dillon như ít sinh_viên khác có lựa_chọn nào khác là vay tiền "
"__TG__","Mỹ phủ_nhận việc yêu_cầu Kofi_Annan từ_chức Đại_sứ Mỹ LHQ John Danforth hôm_qua khẳng_định nước này đặt lòng tin tổng_thư_ký Kofi_Annan muốn đẩy ông rời ghế và nghi_ngờ uy_tín cá_nhân ông đó nghị_sĩ có nhiều ảnh_hưởng đảng Cộng_hoà Mỹ yêu_cầu Annan từ_chức bê_bối xung_quanh chương_trình đổi dầu lấy lương_thực Iraq diễn thời Annan Tuy_nhiên nay chính_quyền tổng_thống Bush khẳng_định sự ủng_hộ dành tổng_thư_ký đương_nhiệm Chúng_tôi đề_xuất hay thúc_đẩy việc từ_chức tổng_thư_ký Chúng_tôi làm_việc ông ấy nhiều năm và trông_đợi làm_việc tiếp ông tương_lai Danforth nói thêm rằng cần phải điều_tra lời cáo_buộc có một đám mây bảo phủ LHQ. Cách duy_nhất xua_tan đám mây đó là nắng rọi vào đại_sứ nói Sức_ép ông Annan tăng khi thượng nghị_sĩ Mỹ Norm_Coleman thành_viên uỷ_ban điều_tra nghi_ngờ về chương_trình đổi dầu tuyên_bố tổng_thư_ký nên từ_chức Nguyên_nhân mà Coleman đưa là chương_trình nói trên tạo kẽ hở tổng_thống Iraq Saddam Hussein biển_thủ chục tỷ đôla Đề_nghị này được thượng nghị_sĩ Cộng_hoà khác ủng_hộ đó con_trai tổng_thư_ký ông Kojo_Annan 29 tuổi bị phát_giác nhận tiền một công_ty giám_sát chương_trình đổi dầu lấy lương_thực Kojo nhận 125.000 USD vòn 4 năm công_ty Cotecna hãng được LHQ trao hợp_đồng Tuy_nhiên tổng_thư_ký nhận sự ủng_hộ mạnh_mẽ thành_viên đại_hội_đồng yêu_cầu ông tại_chức Nghị_sĩ Mỹ kêu_gọi Kofi_Annan từ_chức 02 12 2004 Kofi Annan thất_vọng con_trai 30 11 2004 Con_trai Kofi_Annan bị_cáo_buộc nhận tiền rõ_ràng 27 11 2004 Nhân_viên LHQ tuyên_bố ủng_hộ Kofi_Annan 21 11 2004 Nhân_viên LHQ bỏ_phiếu bất_tín_nhiệm ông Annan 20 11 2004 "
"__TG__","Ngày quan_trọng Blair 23 Hôm sau thứ hai ngày 17 3 cuộc điện_đàm kéo_dài 15 phút Bush và Blair ở Washington và London điều_phối nỗ_lực đảm_bảo có một nghị_quyết chống Họ nhất_trí rằng phải nói_chuyện quan_chức Nga nhiều cấp khác nhau Thủ_tướng Anh nói viễn_cảnh ông khá hơn nhưng hiện_giờ ông gặp khó_khăn Tôi nghĩ tôi thắng Blair nói Tôi lo mức chênh_lệch khi giành thắng_lợi Tôi muốn phụ_thuộc lá phiếu đảng Bảo_thủ Tôi muốn giành thắng_lợi chính_đảng mình Tôi biết tôi thu sự ủng_hộ tất_cả thành_viên đảng nhưng tôi muốn đảng nói rằng có chúng_tôi ông bị thua và tôi nỗ_lực Công đảng đảm_bảo tôi thu đa_số phiếu đảng này Thứ 3 18 3 là ngày quan_trọng Blair nhân_vật chỉ_trích Thủ_tướng Anh nhiều gọi bài phát_biểu kéo_dài một giờ Nghị_viện hôm đó là một diễn_văn hiệu_quả nhất và hay nhất ông tình_thế tiến_thoái lưỡng_nan như hiện_nay thì một lựa_chọn nào là hoàn_hảo một lý_do nào là lý_tưởng Blair tuyên_bố Nhưng quyết_định chúng_ta nắm giữ số_phận nhiều vấn_đề Lúc 13h30 Bush gọi Blair nói Một bài phát_biểu tuyệt_vời Tôi biết tôi phải trải qua cuộc bỏ_phiếu giành thắng_lợi nghị_quyết Thủ_tướng Anh nói máy kiểm phiếu phải làm_việc đêm Vấn_đề duy_nhất là chênh_lệch nhưng tôi hoàn_toàn tự_tin 2 nhà lãnh_đạo nói sự cần_thiết đưa Nga Pháp và Đức trở_lại tham_gia vấn_đề Bush bao_giờ chú_ý cuộc tranh_luận hay bỏ_phiếu cơ_quan lập_pháp nước_ngoài đến vậy Nghị_viện Anh Kết_quả bỏ_phiếu thế_nào ông hỏi nhiều lần ngày hôm đó Cuối_cùng lúc 17h15 tức 22h15 giờ London Nghị_viện Anh bỏ_phiếu Blair giành thắng_lợi 396 phiếu ủng_hộ 217 phiếu chống Mặc_dù nhận sự hậu_thuẫn 1 3 số nghị_sĩ thuộc Công đảng nhưng đảng Bảo_thủ và nước Anh ủng_hộ chiến_tranh Câu hỏi lời đáp phần cuối 02 10 2004 Tuyên_chiến 32 01 10 2004 Tổng_thống Mỹ chuẩn_bị tuyên_bố chiến_tranh 31 29 09 2004 giờ khắc chiến_tranh 30 28 09 2004 Ai tuyên_bố phát_động chiến_tranh Iraq 29 27 09 2004 "
"__TG__","Tòa_án LHQ Thông_tin ông Milosevic chết bị đầu_độc là tin_đồn gt gt tổng_thống Nam_Tư qua_đời trại_giam LHQ gt gt Điều_tra cái chết tổng_thống Nam_Tư khi chúng_tôi có kết_quả chính_xác cái chết ông Milosevic thì thông_tin được đưa là tin_đồn Trưởng công_tố_viên Carla del Ponte nói phía gia_đình ông Milosevic cả bà vợ Mirjana_Markovic và con_trai Marko ông quy trách_nhiệm cái chết chồng và cha họ là tòa_án Họ cho rằng ông Milosevic bị đầu_độc và lời cáo_buộc này xuất_hiện nhiều trang nhất tờ báo Belgrade Serbia số ra hôm_nay Vợ và con ông Milosevic hiện sống Moscow và cả hai đối_mặt cáo_buộc lừa_đảo Serbia đó rõ việc an_táng ông Milosevic liệu có tổ_chức quê nhà hay "
"__TG__","Israel ám_sát một chỉ_huy cao_cấp Hamas Sáng nay trực_thăng chiến_đấu Do_Thái phóng hai quả tên_lửa 3 thành_viên Hamas đó có một chỉ_huy là Wahel Nassar thành_phố Gaza Ông này cùng một chiến_binh xấu_số khác được coi là tác_giả kế_hoạch phục_kích làm chết 6 lính Israel hôm 11 5 Ngoài 3 thành_viên Hamas thiệt_mạng vụ không_kích sáng nay làm 7 thường_dân gồm cả phụ_nữ và trẻ_em bị_thương Tel_Aviv xác_nhận thông_tin vụ không_kích và khẳng_định họ loại_trừ 2 chiến_binh cao_cấp chịu trách_nhiệm vụ đánh bom nhằm binh_sĩ như_thường_dân Israel nhân_chứng cho biết quả tên_lửa đầu_tiên giết chết Wahel_Nassar và một chiến_binh đi xe_máy quận Zeitoun Quả thứ hai phóng đó phút làm chết một chiến_binh khác đi phố Nhiều người tập_trung quanh thi_thể 3 người đàn_ông thái_độ phẫn_nộ Họ thét vang câu Allahu_Akbar Thánh_Allah vĩ_đại và kêu_gọi báo_thù Gia_đình Wahel Nassar tham_gia nhiệt_tình phong_trào nổi_dậy Intifada người Palestine năm qua đó thành_viên gia_đình này nhiều lần trở_thành mục_tiêu tấn_công quân_đội Israel và nay có hơn 10 người bị sát_hại Trước_đây bản_thân Wahel_Nassar hai lần bị Israel mưu_sát nhưng thành Năm_ngoái một quả bom phát_nổ khi quá_trình chế_tạo nhà Nassar làm 3 người thiệt_mạng đó có anh_trai ông "
