"__TT__","3 CLB lớn tranh nhau cầu_thủ 14 tuổi Cầu_thủ trẻ Neymar da Silva Ba đại_gia bóng_đá châu Âu cùng nhòm_ngó tài_năng trẻ Brazil có tên Neymar da Silva 14 tuổi nhưng chú nhóc này được CLB Santos định_giá lên hơn 400 tỷ đồng Việt_Nam Neymar được chuyên_gia săn_lùng cầu_thủ đánh_giá là còn tài_năng hơn Robinho độ tuổi 14 Cách đây gần một năm Real phải mua Robinho giá gần 30 triệu USD. Rút kinh_nghiệm lần này đội bóng Hoàng_gia Tây_Ban_Nha muốn đi một bước nhưng cả MU lẫn Barca có chung ý_tưởng gặt lúa non này Hiện Neymar được đào_tạo lò tài_năng trẻ Santos và CLB này tỏ ra lo_ngại sự nhòm_ngó ông lớn tiền ngày gần đây ban lãnh_đạo Santos đạt thỏa_thuận ràng_buộc cực_kỳ_quan_trọng đại_diện Neymar ông Wagner_Ribeiro là đại_diện Robinho đó Neymar ở lò đào_tạo Santos năm 2008 16 tuổi tiếp là ký bản hợp_đồng chuyên_nghiệp có thời_hạn 3 năm tới 2011 Bất_kỳ đại_gia nào muốn phá vỡ điều_khoản này phải trả Santos 25 triệu USD. Gia_đình cầu_thủ sinh ngày 5 2 1992 tỏ hài_lòng họ muốn Neymar tiếp_tục được luyện_tập CLB sản_sinh ra huyền_thoại Pele "
"__TT__","thời_gian dài vật_lộn chấn_thương Vitali_Klitschko quyết_định treo găng giữa tuần này Thế_là làng quyền Anh hạng nặng thế_giới phải chia_tay một tên_tuổi lớn Đó là quyết_định khó_khăn nhưng tôi muốn được ra đi khi còn đỉnh_cao sự_nghiệp mở_đường lớp kế_thừa tiến lên Chấn_thương chứ phải tay đấm nặng_ký hành_hạ tôi thời_gian gần đây Vitali Klitschko ngậm_ngùi lời ngắn_ngủi và đứt_quãng này tay đấm 34 tuổi người Ukraine chính_thức chia_tay trận_đấu đẫm mồ_hôi và máu chia_tay chiếc đai vô_địch đầy vinh_quang và ẩn_chứa nhiều bất_trắc Khán_giả yêu quyền Anh bao_giờ có cơ_hội_chứng_kiến cuộc đối_đầu đỉnh_cao Klitschko và Hasim_Rahman tranh đai vô_địch Hội_đồng quyền Anh thế_giới WBC vốn dự_tính diễn ngày_mai đấu_trường Las_Vegas Quyết_định chia_tay gần như là bắt_buộc một tay đấm nổi_tiếng nhất thế_giới này khi đấm gục nhà vô_địch người Anh Danny_Williams người hạ võ_sĩ thép Mike_Tyson tháng 12 năm_ngoái Klitschko thượng_đài một phút nào chấn_thương Tất_cả gì anh làm thời_gian đó là cổ_vũ người em_trai nổi_tiếng Wladimir_Klitschko Khi ngày động thủ gần Klitschko gặp nạn sàn tập và phải lên bàn mổ Thế_là tuổi 34 anh quyết_định treo găng Nhớ ngày_trước thời_buổi mà khán_giả yêu trò_chơi bạo_lực bắt_đầu chán ngấy một Mike Tyson hung_hăng bạo_tàn một Lennox Lewis cẩn_trọng lười_nhác và một Evander Holyfield già đi nhanh_chóng thì V. Klitschko biệt_danh trái đấm sắt cùng người em Wladimir xuất_hiện Hai người con_trai một viên phi_công Xô viết nhanh_chóng tạo_dựng tên_tuổi chốn võ_đài_đầy hiểm_nguy mỗi nắm_đấm họ hàng_loạt gã khổng_lồ hung_hãn khuỵu Khi có được chỗ_đứng trang_trọng anh_em nhà Klitschko tiến đến thách_thức tay đấm mạnh Cuộc_chiến người anh_trai Vitali_Klitschko và đấu_thủ xứ sương_mù Lennox Lewis tranh đai WBC Los Angeles ngày 21.6.2003 ghi_nhận như là một trận_đấu khốc_liệt nhất quyền Anh hạng nặng 20 năm qua trận_đấu này Klitschko thi_đấu tưng_bừng liên_tục dồn Lewis thế phòng_thủ bị_động nhưng cuối_cùng sự nóng_vội giết chết tham_vọng anh một khoảnh_khắc bất_cẩn Klitschko bị dính đòn phản_kích đối_thủ và đó buộc phải rời võ_đài máu chảy nhiều Thua trận nhưng tay đấm Ukraine xác_lập tên_tuổi mình cú đánh tay phải nhanh như điện xẹt và mạnh như trái phá anh bốn_phương truyền_tụng Tháng 4.2004 Klitschko bước lên đỉnh vinh_quang danh_hiệu vô_địch WBC khi hạ võ_sĩ Nam Phi_Corrie Sanders Thế khi hừng_hực quyết_tâm thì chấn_thương ngăn cho anh tiếp_tục vung nắm_đấm Klitschko chia_tay để một sự_nghiệp đáng nể 35 trận thắng đó có 34 trận thắng knock out và có 2 trận bại "
"__TT__","Chiến_thắng dễ_dàng M. Schumacher GP Đức Đương_kim vô_địch hoàn_toàn thống_trị cuộc đua và chiến_thắng lần thứ 11 sau 12 chặng kể đầu mùa giải F1 năm nay Jenson Button đánh_bại Fernando_Alonso cuộc_chiến giành ngôi á quân đó là nét nổi_bật Grand Prix_Đức diễn ra_chiều qua Điểm sáng chặng đua Hockenheim hôm_qua là cuộc đọ sức Button đội BAR Honda và Alonso Renault nhất_là khi chiến_thắng định_đoạt sớm Mặc_dù khi về đích Michael_Schumacher có phát_biểu đây là một cuộc đua khó_khăn và rằng tôi thực_sự gặp nhiều khó_khăn phía Kimi_Raikkonen chuyện được an_bài vòng 14 Michael_Schumacher xuất_phát hàng cùng và anh bảo_toàn vị_trí dẫn_đầu khi đoàn đua lao góc cua đầu_tiên khi đó Juan Pablo_Montoya Williams rơi xuống thứ_tư Kimi_Raikkonen McLaren và Fernando_Alonso Renault qua_mặt Raikkonen bám sát đối_thủ đội Ferrari nhưng nỗ_lực bám đuổi tay_đua người Phần_Lan chấm_dứt khi cánh đuôi xe anh bị tung vòng 14 Chiếc McLaren lao ra khỏi đường đâm rào_chắn lốp xe Kể thời_điểm đó M. Schumacher hoàn_toàn kiểm_soát cuộc đua và cuối_cùng cán đích thời_gian một giờ 23 phút 54,848 giây sau 66 vòng đường đua Hockenheim dài tổng_cộng 302 km Như_vậy M. Schumacher cân_bằng kỷ_lục anh lập ra năm 2002 là về nhất 11 chặng đua cùng một mùa giải Đây là lần thứ ba tay_lái người Đức bước lên bục cao nhất Hockenheim đường đua nhà nhưng là chiến_thắng thứ sáu liên_tiếp 7 chặng đua gần đây bảng xếp_hạng khoảng_cách giữa M. Schumacher đối_thủ xếp phía sau được nới rộng thành 36 điểm Tuy_vậy một_mình M. Schumacher đủ giúp Ferrari sớm đăng_quang ngôi vô_địch đồng_đội chặng này Rubens Barrichello có_mặt tốp tay_đua giành điểm kể M. Schumacher Jenson Button là gương_mặt nổi_bật nhất Tay_lái người Anh thi_đấu xuất_sắc vòng phân_hạng khi giành vị_trí thứ ba Tuy_vậy thay động_cơ khi chạy thử xe hôm thứ sáu luật Button bị đánh tụt 10 bậc thứ_tự xuất_phát Từ_vị_trí 13 Button leo thứ 9 khi vượt qua góc cua đầu_tiên Khi đoàn đua bắt_đầu lượt pit đầu_tiên tay_đua đội BAR Honda có_mặt tốp 5 xe dẫn_đầu Và cuối_cùng anh thành_công việc tước ngôi á quân Fernando Alonso vòng cuối một_cách ngoạn_mục Đồng_đội Alonso Jarno_Trulli thể_hiện phong_độ kém_cỏi đúng ngày anh tuyên_bố chia_tay Renault cuối năm Trulli cán đích thứ 11 Rubens_Barrichello David_Coulthard McLaren bắt_đầu cuộc đua vị_trí thứ_tư và đó là thứ hạng anh khi về đích Người cán đích thứ năm là Juan Pablo_Montoya Williams một kết_quả thất_vọng lúc cuộc đua diễn tay_đua quốc_tịch Colombia tuyên_bố ngăn_cản chiến_thắng M. Schumacher Tuy_nhiên thứ_bảy và giành 2 điểm Antonio_Pizzonia đồng_đội Montoya là một bất_ngờ Pizzonia là tay_lái dự_bị Williams chặng này góp_mặt thế chỗ Ralf Schumacher dưỡng_thương Kết_quả Grand Prix Đức TT Tay_đua Đội Điểm Thời_gian 1M Schumacher Ferrari 10 1h23 54848 2Jenson Button BAR 8 00 08388 3Fernando Alonso Renault 6 00 16351 4David Coulthard McLaren 5 00 19231 5J P. Montoya Williams 4 00 23055 6Mark Webber Jaguar 3 00 41108 7Antonio Pizzonia Williams 2 00 41956 8Takuma Sato BAR 1 00 46842 9G Fisichella Sauber 0 01 07102 10 Christian Klien Jaguar 0 01 08578 11 Jarno Trulli Renault 0 01 10258 12 Rubens Barrichello Ferrari 0 01 13252 13 Felipe Massa Sauber 0 1 vòng 14 Olivier Panis Toyota 0 1 vòng 15 Giorgio Pantano Jordan 0 3 vòng 16 Zsolt Baumgartner Minardi 0 4 vòng 17 Gianmaria Bruni Minardi 0 4 vòng xNick Heidfeld Jordan 0 24 vòng xCristiano da Matta Toyota 0 28 vòng xKimi Raikkonen McLaren 0 53 vòng TT Đội Điểm 1Ferrari 10 2BAR Honda 93 Renault 64 Williams BMW 65 McLaren Mercedes 56 Jaguar Cosworth 3 Bảng xếp_hạng mùa giải F1 năm 2004 TT Tay_đua Đội Điểm 1Michael Schumacher Ferrari 110 2Rubens Barrichello Ferrari 74 3Jenson Button BAR 61 4Jarno Trulli Renault 46 5Fernando Alonso Renault 39 6Juan Pablo Montoya Williams 33 7David Coulthard McLaren 19 8Kimi Rikknen McLaren 18 9Takuma Sato BAR 15 10 Giancarlo Fisichella Sauber 13 11 Ralf Schumacher Williams 12 12 Mark_Webber Jaguar 713 Felipe Massa Sauber 514 Olivier Panis Toyota 515 Cristiano da Matta Toyota 316 Nick Heidfeld Jordan 317 Timo Glock Jordan 218 Antonio_Pizzonia Williams 219 Zsolt Baumgartner Minardi 120 Christian Klien Jaguar 021 Marc Gené Williams 022 Giorgio Pantano Jordan 023 Gianmaria Bruni Minardi 0TT Đội Điểm 1Ferrari 184 2Renault 85 3BAR Honda 76 4Williams BMW 47 5McLaren Mercedes 37 6Sauber Petronas 18 7Toyota 88 Jaguar Cosworth 79 Jordan_Ford 510 Minardi_Cosworth "
"__TT__","Mở đường đua xưa Gần_nửa thế_kỷ khi vòng đua Đông_Dương khép xe_đạp Việt_Nam bắt_đầu trở_lại đường đua xưa cuộc đột_phá ngày 9 4 Tuy là khởi_đầu nhưng cuộc đua Cúp_Truyền_hình TPHCM lần thứ 18 2006 mở_rộng VN Lào được xem là tiền_đề cuộc đua xuyên qua nhiều nước Đông_Nam_Á tương_lai Giải nhiều cái Trải qua 17 năm tổ_chức đó có 3 lần đường đua Cúp_Truyền_hình TPHCM được mở_rộng Hà_Nội TPHCM nhiều người nghĩ rằng như thế_là đủ tầm một cuộc đua lớn duy_nhất VN. Tuy_nhiên mục_đích phục_vụ và phát_triển phong_trào xe_đạp nước ngày thêm lớn_mạnh đặc_biệt là xây_dựng uy_tín cuộc đua nhà tổ_chức nảy ý_định táo_bạo là mở_rộng đường đua sang nước bạn láng_giềng như kỳ đua xuyên Đông_Dương danh_tiếng thập_niên 50 thế_kỷ trước Quyết_tâm đó thành hiện_thực kể ngày 9 4 hơn 2 năm chuẩn_bị Một cuộc bứt_phá mức đến Hội_trường Thống_Nhất Ảnh T. K có_thể đưa đoàn đua hoàn_thành suốt 19 chặng thi_đấu tổng_đường dài 2.271 km dài nhất trước nay số tiền thưởng lên 500 triệu đồng gấp đôi giải năm_ngoái đòi_hỏi nhà tổ_chức phải mất nhiều công_sức quá_trình chuẩn_bị Ông Mã_Diệu_Cương phó_ban tổ_chức cho biết tính phần lo thủ_tục xuất nhập_cảnh tổ_chức đưa và đón đoàn khoảng 300 thành_viên tham_gia cùng lúc qua cửa_khẩu một kỷ_lục khác là chúng_tôi phờ cả người Đó là nói việc thăm_dò hơn 500 km đường đua mới đất Lào và cả nơi ăn cho đoàn đua Chú_trọng chất_lượng Tuy số_lượng đội được mời tham_dự cuộc đua năm nay có ít hơn lần trước nhưng đây là tay_đua mạnh làng xe_đạp VN và Thái_Lan số 10 đội nước sự trở_lại đội Hà_Nội và Huế đem giải bất_ngờ chặng phía Bắc hoặc miền Trung Còn đội phía Nam tựu_trung là cuộc tranh_chấp 3 ứng_viên nặng_ký gồm Bảo_vệ Thực_vật Sài_Gòn – Dofilm BVTVSG DF Domesco_Đồng_Tháp D. ĐT và Bảo_vệ THựC_VậT AN GIANG BVTVAG Đội BVTVSG DF là một tập_hợp tay_đua mạnh TPHCM gồm Nguyễn_Nam_Cực Trương_Quốc_Thắng Lưu_Quốc_Vinh bề dày kinh_nghiệm từng cá_nhân tập_thể này có nhiều khả_năng tấn_công chặng quyết_định giành lấy vị_trí cá_nhân và đồng_đội khi đó ưu_thế D. ĐT là cuộc bứt_phá tốc_độ đích đến 2 anh_em Trịnh Phát_Đạt Trịnh Sang Đông bên cạnh đó là phong_độ dẻo_dai khi chinh_phục ngọn đèo Mai Công Hiếu Còn BVTVAG tuy nội_lực đội này dựa cuộc tăng_tốc đột_biến bộ đôi Nguyễn_Hữu_Đức – Hữu_Hiền nhưng nhờ có sự hỗ_trợ Lâm Công_Danh Trần_Tử_Dương nên họ được xem là kẻ phá_bĩnh thời_điểm quan_trọng Đội nước_ngoài duy_nhất có_mặt cuộc đua năm nay là Không_quân Hoàng_Gia Thái_Lan tuy_nhiên danh_tính VĐV được công_bố Nhưng bề dày truyền_thống cùng thành_tích nhiều cuộc đua quốc_tế vị khách mời này là đối_thủ khó_chịu Bốn chặng đất bạn Cuộc đua xuất_phát thủ_đô Hà_Nội ngày 9 4 đó đoàn đua tuần_tự di_chuyển tỉnh Thanh_Hóa Nghệ_An khi sang Lào đây cuộc đua thi_đấu 4 chặng đồng_thời tổ_chức đón Tết cổ_truyền Bum pi may Lào đó trở VN qua cửa_khẩu Lao_Bảo Huế đoàn đua tiếp_tục hành_trình về phương Nam và kết_thúc TPHCM đúng ngày 30 4 lịch_sử thời_gian đoàn đua lưu Lào Đài_Truyền_hình TPHCM phối_hợp Đài_Truyền_hình Quốc_gia Lào thực_hiện chương_trình cầu truyền_hình Nhịp cầu hữu_nghị TP Viêng_Chăn và TPHCM nhiều hoạt_động giao_lưu văn_hóa nghệ_thuật giữa nhân_dân hai TP kết_nghĩa Chương_trình được truyền_hình trực_tiếp lúc 20 giờ ngày 14 – 4 kênh HTV9 và Đài_Truyền_hình Quốc_gia Lào "
"__TT__","Premier_League Chelsea tiếp_tục giành chiến_thắng Crespo vui_mừng bàn thắng Chelsea tiếp_tục chuỗi thành_tích bất_bại mình trận thắng đội đứng áp_chót bảng xếp_hạng Birmingham tỳ số 2 0 củng_cố vững_chắc ngôi_vị đầu_bảng mình Premiership khi đó Arsenal bị cầm hòa 0 0 sân Aston_Villa Được thi_đấu sân_nhà Stamford_Bridge phải thi_đấu một đội ngụp_lặn vị_trí cuối bảng nên vào trận Chelsea thi_đấu tâm_trạng tự_tin và thoải_mái phút đầu_tiên trận_đấu Chelsea áp_đặt lối chơi mình phần sân Birmingham làm hàng hậu_vệ B phài chống_đỡ vất_vả Tuy_nhiên phải đợi phút 25 khi nhận một đường bóng chọc khe trung_lộ Roben đột_phá khu_vực cấm_địa và bình_tĩnh sửa bóng góc xa khung_thành Birmingham nhưng thủ_môn Taylor phản_xạ kịp_thời đẩy bóng ra ngoài nhưng cú đá bồi đó Crespo làm mành lưới Birmingham rung lên giúp Chelsea vượt dẫn trước tỷ_số 1 0 bàn mở tỷ_số cầu_thủ Chelsea tiếp_tục lao lên tấn_công phía Birmingham phùt 43 khi nhận đường chuyền giữa sân vào Crespo dùng ngực nhả bóng Gudjohnsen cầu_thủ này có một đường chuyền chọc khe thuận_lợi Roben biên trái băng đưa bóng góc xa Taylor giúp Chelsea nhân đôi cách_biệt • Kết_quả trận_đấu còn Aston_Villa Arsenal 0 0 Charlton_Athletic West_Ham 2 0 Chelsea Birmingham 2 0 Tottenham Newcastle 2 0 Liverpool West_Bromwich 1 0 Manchester_Utd Bolton 4 1 Middlesbrough Manchester City 0 0 Portsmouth Fulham 1 0 Sunderland Everton 0 1 Wigan_Athletic Blackburn 0 3 hiệp 1 này tiền_đạo Crespo thi_đấu xông_xáo gây nhiều khó_khăn hàng phòng_thủ Birmingham và nếu may_mắn hơn Crespo có_thể ghi thêm bàn lưới Birmingham Phía Birmingham có pha phản_công nguy_hiểm mà điển_hình là cú đánh_đầu vọt sà ngang tiền_đạo Heskey hiệp 2 cầu_thủ Birmingham thi_đấu có phần quyết_tâm hơn nhưng một đối_thủ mạnh như Chelsea Birmingham làm gì hơn là đành chịu thêm một thất_bại Premiership Phía Chelsea dù dẫn trước 2 0 nhưng cầu_thủ họ lao lên tấn_công nhằm kiếm thêm bàn thắng Tuy_nhiên cơ_hội được tạo bị chân sút bỏ_qua đáng tiếc Chung_cuộc Chelsea thắng Birmingham 2 0 tiếp_tục khẳng_định sức_mạnh mình giải ngoại_hạng Anh khoảng_cách là 11 điểm so đội đứng thứ hai Manchester_United "
"__TT__","Rạng sáng qua khi tiếng còi kết_thúc trận Lille Bordeaux 3 2 vang là lúc Olympique Lyon chính_thức đăng_quang Ligue 1 lần thứ 5 liên_tiếp xác_lập một kỷ_lục mới bóng_đá Pháp Tuy_nhiên thành_tích lịch_sử này chẳng_thể làm người hâm_mộ quên thất_bại mới nhất Lyon đấu_trường châu Âu 3 mùa bóng liên_tiếp Lyon bao_giờ tiến xa vòng tứ_kết Champions_League một đội_hình thừa_mứa cầu_thủ đẳng_cấp cao được dẫn_dắt một HLV giàu kinh_nghiệm như Gérard_Houllier Lyon vất_vả việc thống_trị bóng_đá Pháp năm 2002 2004 Lyon phải vất_vả giành vị_trí đầu_bảng xếp_hạng mùa bóng 2004 2005 thì nắm quyền dẫn_đầu lượt đấu thứ 10 Riêng năm nay họ một_mình vị_trí dẫn_đầu lượt đấu thứ 5 khoảng_cách ngày_càng nới rộng Dẫu_vậy Lyon chẳng_thể leo thêm một nấc nào Champions_League Thất_bại này tràn_ngập nỗi cay_đắng khi Lyon cầm_cự AC Milan phút 88 trận tứ_kết lượt về khi Filippo Inzaghi ghi_bàn thắng chết người thứ nhì Họ mất tất_cả 2 phút cuối_cùng khi mà trận chung_kết được xếp đấu sân_nhà Stade de France ngày 17.5 tới Nhưng bây_giờ thì ăn_mừng nay có CLB Pháp nào lập được thành_tích vô_địch Ligue 1 liên_tiếp 5 mùa bóng Saint Etienne 1967 1970 và Marseille 1989 1992 dừng 4 lần vô_địch Ligue 1 liên_tiếp Dẫu Lyon đăng_quang khi ở khách_sạn Boulogne Billancourt ngoại_ô Paris cả khi bước trận gặp PSG nhưng HLV Gérard Houllier khẳng_định Chúng_tôi trở_thành nhà vô_địch sân_cỏ và tuyên_bố rằng Lyon giành danh_hiệu vô_địch trước_hết là nhờ cầu_thủ hàng tiền_đạo xuất_sắc nhất và hàng phòng_thủ đứng thứ nhì một mùa giải mà họ thua 2 trận 14 điểm cách_biệt đội nhì bảng Bordeaux chẳng_thể_nào đuổi kịp cho_dù có thắng 4 trận còn khi đó trận thắng Bordeaux 3 2 Lille trở_lại cuộc đua_tranh suất tham_dự Champions_League tương_tự như trường_hợp OM thắng đậm Nancy 6 0 thành_công lượt đấu này có Auxerre thua 2 3 Nantes và Lens 0 2 Saint Etienne Còn Troyes thoát khỏi nhóm tụt hạng trận thắng Ajaccio 3 0 Kết_quả trận_đấu còn Toulouse Metz 2 0 Le_Mans Monaco 0 0 Sochaux Strasbourg 1 1 Ở Tây_Ban_Nha Deportivo La_Coruna bị Sevilla cầm_chân 0 0 và vuột mất vị_trí thứ 5 nếu như_không có 4 pha cứu bóng quyết_đoán thủ_môn José Francisco Molina thì Depor có_lẽ sụp_đổ sân_nhà đó trận Mallorca Alaves kết_thúc tỷ_số 0 0 dẫu cả hai đội mong_muốn thoát nhóm cầm đèn_đỏ Real Sociedad hạng 18 leo hạng 16 trận thắng quý_giá Racing_Santander 1 0 Lượt trận thứ 34 Anh mỉm cười đội bóng thành London Chelsea nới rộng khoảng_cách đội nhì bảng M. U lên 9 điểm trận thắng Bolton 2 0 thì đội hạng 4 Tottenham và hạng 5 Arsenal giành chiến_thắng bảo_tồn nguyên_vẹn cơ_hội tham_dự Champions_League mùa tới Tottenham thắng Everton 1 0 bàn thắng quả phạt_đền Robbie_Keane còn khẩu thần công dễ_dàng đè_bẹp West_Bromwich Albion 3 1 Robert_Pires 76 và Dennis_Bergkamp 89 giúp Arsenal duy_trì khoảng_cách 4 điểm Tottenham khi đội khách gỡ hòa phút 72 Kết_quả trận_đấu khác Newcastle Wigan 3 1 West_Ham Manchester City 1 0 Fulham Charlton 2 1 Portsmouth Middlesbrough 1 0 Ý Juve phải đợi thời_gian đấu bù giờ giành 1 điểm túi Cagliari 1 1 Như_vậy khi Serie A còn 4 lượt đấu cuối khoảng_cách Juve và Milan thắng Inter 1 0 rút có 5 điểm Fiorentina đoạt vị_trí thứ 4 Roma nhờ trận thắng Treviso 3 1 còn Roma bị cầm_chân Palermo 3 3 trận còn Chievo Messina 2 0 Empoli Siena 2 1 Lazio Livorno 3 1 Lecce Udinese 1 2 Reggina Ascoli 2 0 Sampdoria Parma 1 2 Còn Đức Bayern Munich quên thất_bại Bremen khi đánh_bại Arminia Bielefeld 2 0 Hamburg tiếp_tục bám sát nhờ thắng dễ_dàng đội cuối bảng Duisburg 2 0 khi đó Werder đành bằng_lòng trận hòa 1 1 sân Wolfsburg như Schalke 04 trước Cologne 1 1 trận còn Hertha_Berlin Borussia Dortmund 0 0 Leverkusen M Gladbach 2 1 Francfurt Mainz 0 0 "
"__TT__","Campbell trở_lại trung_tâm huấn_luyện Arsenal Sol_Campbell và ông Wenger trung_tâm huấn_luyện Trung_vệ Sol_Campbell trở_lại trung_tâm huấn_luyện Arsenal khi mất_tích một_cách bí_ẩn ngày qua báo_chí Anh đồng_loạt đưa tin ngày hôm_qua Campbell cùng tập_luyện khẩu thần công kể khi trận_đấu sân_nhà Highbury hôm thứ 4 tuần trước trận thua 3 2 đội khách West_Ham_United anh bị thay ra Tuy_nhiên trận_đấu anh tập_trung cùng đội và báo_cáo trách_nhiệm trung_tâm huấn_luyện London_Colney phía bắc London Trung_vệ 31 tuổi đội_tuyển Anh vắng_mặt trận Arsenal thắng 2 0 Birmingham City hôm thứ 7 lời đồng_đội Arsenal thì Sol Campbell cần khoảng thời_gian giải_quyết vấn_đề cá_nhân nhất là chuyện tình_ái Tuy_nhiên luật_sư Campbell lên_tiếng bác_bỏ ông khẳng_định có trường_hợp thân_chủ mình bỏ trốn Sol chắc_chắn trong_sạch Anh cần thời_gian và không_gian lấy tinh_thần luật_sư Bon_Battu nhấn_mạnh Anh có vấn_đề cá_nhân về điều gì và trở_lại trung_tâm huấn_luyện tuần tới HLV Arsenal giáo_sư Arsene Wenger nói trận_đấu Birmingham rằng ông nói_chuyện Sol_Campbell người mắc lỗi bàn thắng đầu_tiên West_Ham Anh trở_lại tập_luyện cùng đội bóng Wenger nói Trận_đấu tới Arsenal là trận tiếp Bolton Wanderers sân_nhà thứ 7 tới "
"__TT__","Federer bảo_vệ thành_công_chức vô_địch Masters Cup Một mùa thi_đấu thành_công mong_đợi Roger_Federer khép danh_hiệu Masters_Cup Lần thứ hai liên_tiếp tay_vợt Thụy_Sĩ đăng_quang giải_đấu cuối năm ATP. Anh vượt qua Lleyton_Hewitt tỷ_số 6 3 6 2 một trận chung_kết ướt_át Tay_vợt số một thế_giới lập một kỷ_lục quần_vợt hiện_đại khi giành chiến_thắng thứ 13 liên_tiếp trận chung_kết Đây là danh_hiệu thứ 11 năm 2004 anh giải_thưởng 1,52 triệu USD. Năm nay là một mùa thi_đấu khó quên Tôi bị chấn_thương nhưng có màn tái_xuất ấn_tượng giành danh_hiệu này Tôi đòi_hỏi gì hơn anh nói Trận chung_kết diễn muộn dự_định và rồi phải trì_hoãn trời mưa BTC thông_báo khả_năng phải rời trận chung_kết sang thứ hai nhưng may ông trời có mắt Phần còn cuộc so tài diễn cuối ngày và hai set Set thứ nhất kéo_dài 27 phút khi trời đổ mưa Federer dẫn 5 2 Và khi hai tay_vợt trở_lại sân Federer nhanh_chóng hoàn_tất set đầu_tiên Tay_vợt Thụy_Sĩ thực_hiện quả giao_bóng hoàn_hảo và thành_công 9 quả toàn_bộ set đầu_tiên Hơn thế anh có 7 lần ăn điểm trực_tiếp Set thứ hai Federer chiếm ưu_thế break game giao_bóng đầu_tiên Hewitt Anh còn một lần thành_công game giao_bóng đối_thủ dẫn 5 2 và chiến_thắng chung_cuộc ai phủ_nhận sức_mạnh Federer nhưng khách_quan mà nói trận chung_kết gây được ấn_tượng chiến_thắng anh Marat Safin ở bán_kết Lần thứ 6 liên_tiếp thất_bại Federer Hewitt biết nói gì lời chúc_mừng Tôi muốn gửi lời chúc_mừng Federer giải_đấu này mà cho cả mùa bóng nhất_là cách chơi và phong_độ anh ấy hiện_nay Federer xứng_đáng là tay_vợt số 1 Federer có trận thắng thứ 23 liên_tiếp đối_thủ top 10 thế_giới Anh trở_thành tay_vợt đầu_tiên thời Ivan Lendl năm 1986 87 giành hai danh_hiệu Masters_Cup liên_tiếp mà để thua một trận_đấu nào "
